<?xml version="1.0" encoding="UTF-8"?>
<recipe xmlns:xsi="http://www.w3.org/2001/XMLSchema-instance"
	xsi:noNamespaceSchemaLocation="recipe.xsd">
	<RecipeIdentifier>R1</RecipeIdentifier>
	<NameText>Recipe1</NameText>
	<Description>Recipe 1 description</Description>
	<IngredientList>
		<Ingredient>
			<DataCenter>Dallas</DataCenter>
			<PtimesListQ>
				<HeaderText>Select your Server configuration</HeaderText>
				<Corestructure>
					<SKU>01-001-0001</SKU>
					<Quantity>0</Quantity>
					<Price>0.0</Price>
					<DateTimeCreate>2001-01-01</DateTimeCreate>
				</Corestructure>
				<Corestructure>
					<SKU>01-001-0002</SKU>
					<Quantity>0</Quantity>
					<Price>0.0</Price>
					<DateTimeCreate>2001-01-01</DateTimeCreate>
				</Corestructure>
				<Corestructure>
					<SKU>01-001-0003</SKU>
					<Quantity>0</Quantity>
					<Price>0.0</Price>
					<DateTimeCreate>2001-01-01</DateTimeCreate>
				</Corestructure>
				<Corestructure>
					<SKU>01-001-0004</SKU>
					<Quantity>0</Quantity>
					<Price>0.0</Price>
					<DateTimeCreate>2001-01-01</DateTimeCreate>
				</Corestructure>
				<Corestructure>
					<SKU>01-001-0005</SKU>
					<Quantity>0</Quantity>
					<Price>0.0</Price>
					<DateTimeCreate>2001-01-01</DateTimeCreate>
				</Corestructure>
			</PtimesListQ>
			<PtimesListQ>
				<HeaderText>Select your Server configuration</HeaderText>
				<Corestructure>
					<SKU>01-001-0001</SKU>
					<Quantity>0</Quantity>
					<Price>0.0</Price>
					<DateTimeCreate>2001-01-01</DateTimeCreate>
				</Corestructure>
				<Corestructure>
					<SKU>01-001-0002</SKU>
					<Quantity>0</Quantity>
					<Price>0.0</Price>
					<DateTimeCreate>2001-01-01</DateTimeCreate>
				</Corestructure>
				<Corestructure>
					<SKU>01-001-0003</SKU>
					<Quantity>0</Quantity>
					<Price>0.0</Price>
					<DateTimeCreate>2001-01-01</DateTimeCreate>
				</Corestructure>
				<Corestructure>
					<SKU>01-001-0004</SKU>
					<Quantity>0</Quantity>
					<Price>0.0</Price>
					<DateTimeCreate>2001-01-01</DateTimeCreate>
				</Corestructure>
				<Corestructure>
					<SKU>01-001-0005</SKU>
					<Quantity>0</Quantity>
					<Price>0.0</Price>
					<DateTimeCreate>2001-01-01</DateTimeCreate>
				</Corestructure>
			</PtimesListQ>
			<PtimesQ>
				<Corestructure>
					<SKU>01-001-0006</SKU>
					<Quantity>0</Quantity>
					<Price>0.0</Price>
					<DateTimeCreate>2001-01-01</DateTimeCreate>
				</Corestructure>
			</PtimesQ>
			<PtimesQ>
				<Corestructure>
					<SKU>01-001-0007</SKU>
					<Quantity>0</Quantity>
					<Price>0.0</Price>
					<DateTimeCreate>2001-01-01</DateTimeCreate>
				</Corestructure>
			</PtimesQ>
			<OptionList>
				<Corestructure>
					<SKU>01-001-0008</SKU>
					<Quantity>0</Quantity>
					<Price>0.0</Price>
					<DateTimeCreate>2001-01-01</DateTimeCreate>
				</Corestructure>
				<OptionValue>1</OptionValue>
				<OptionValue>2</OptionValue>
				<OptionValue>3</OptionValue>
				<OptionValue>4</OptionValue>
			</OptionList>
			<OptionList>
				<Corestructure>
					<SKU>01-001-0008</SKU>
					<Quantity>0</Quantity>
					<Price>0.0</Price>
					<DateTimeCreate>2001-01-01</DateTimeCreate>
				</Corestructure>
				<OptionValue>1</OptionValue>
				<OptionValue>2</OptionValue>
				<OptionValue>3</OptionValue>
				<OptionValue>4</OptionValue>
			</OptionList>
			
		</Ingredient>
	</IngredientList>
</recipe>
